,title,text,uuid
364,Is there a limit on how much I can deposit into my savings account?,"No, you can deposit as much money in your savings account as you want.",Lc4Wx6sQUCKEbsoy5pKwf5
365,What is an assignee of an auto loan?,An assignee is a person or a company who buys your auto loan.,n7KLRXN9jT6wHPz74EFue3
366,"I closed my interest-bearing account, but the bank/credit union did not pay me interest up until the day I withdrew the money. Why?","If you closed the account before the bank or credit union credited the interest, generally the bank or credit union won’t pay that interest. This is known as “forfeiture of interest.”",Kw7MponbhFSivZqbsxDbN7
367,Can a creditor refer my account to a collection agency before my debt is due? Do I have to be told before a debt is turned in to collections?,"While the creditor does not have to tell you before sending your account to a debt collector, usually they will try and collect the debt from you before sending to a collector.",dA5CZ3sYJsgggK32D96ZB4
368,What should I do if the house or apartment I’m renting goes into foreclosure?,"Know Your Rights, look for notices, ask questions. You may want to consult an attorney.",LmCaai3dxwEnqo8QdExPdB
369,"If I have a Perkins loan and I am interested in Public Service Loan Forgiveness, what do I need to know?","Before you enroll in Public Service Loan Forgiveness, you should know that if you have a Perkins loan, you may be eligible for a different benefit if you work in certain public service professions.",eGtqkatvvBiHj4HprNdXQD
370,What is Pay As You Earn (PAYE)? How do I know if I qualify?,"Pay As You Earn, or PAYE, is a new federal student loan repayment plan that is now available to some borrowers with newer federal loans. It caps your monthly federal student loan payment at 10 percent of your discretionary income.",LGXLuLSBEfyqcepVn5Y4cE
371,Public Service Loan Forgiveness requires ten years of monthly payments to qualify for loan forgiveness. Do I get any benefit if I fall short?,"If you leave public service even one monthly payment short of the required 120, you will not be eligible for loan forgiveness and will be required to repay in full.",BHHCXshp5hQ6gCPfGJAMpt
372,I understand that there may be other student loan benefits for certain teachers. Is Public Service Loan Forgiveness always the best choice?,"Highly-qualified teachers in certain low-income schools may be eligible for a different loan forgiveness program that provides $5,000 in loan forgiveness after the completion of five academic years as an elementary or secondary school teacher. Highly-qualified math, science or special education teachers may be eligible for up to $17,500 in loan forgiveness after the completion of five academic years as a teacher in an eligible school.",L4XXX8TAzVwdxTjcCkMifd
373,I want to certify that I work for a qualified employer in order to qualify for Public Service Loan Forgiveness. What do I do?,Complete the Employment Certification for Public Service Loan Forgiveness  to keep track of your eligible employment and qualifying loan payments under the Public Service Loan Forgiveness program.,ZEap5Y4UNWTyegnqj2BDVw
374,How can I get a refund on a product or service I purchased with my credit card?,"First, reach out to the company that sold the product or service to you. Explain the issue. Maybe the product you received was defective or you didn’t receive what you ordered. Ask the company if it will reverse the charge.",g9ynYWN4pFW6bkkQ99FEuN
375,I recently inherited a house. The mortgage lender said it’s required to determine my “ability to repay” before it will let me take over the mortgage loan. Is this true?,"Not necessarily. If you already have title to the house, the CFPB’s rules don’t require the lender or servicer to determine your ability to repay before it lets you take over the mortgage loan.",gE4tLVAiMnkoYGHi7K5hTG
376,I recently declared bankruptcy. Now my mortgage servicer said it’s not allowed to send me a monthly mortgage statement. Is that correct?,No. The CFPB’s rules don’t prevent your mortgage servicer from sending you a periodic mortgage statement if you’re going through bankruptcy.,fwzsDngdgU6DrAUnwZehCe
377,How can I protect myself and others I care about from fraud and scams?,There are several steps you can take to protect yourself and others from fraud and scams.,hmQ7YC8jJdi99FW8UEPsM2
378,"How can I tell if a friend, neighbor, or family member is a victim of financial exploitation?",Look out for common signs of financial exploitation.,5nX9ua6QijCKnUcsPqYFCZ
379,My loans are eligible for a deferment because I’m serving in the military or volunteering in the Peace Corps. What does this mean?,A student loan deferment is a repayment arrangement that postpones your monthly student loan payment for a period of time.,RZF3s4c8gCAMVgAqEJX2sk
380,What is the finance charge on a mortgage?,A finance charge is the total amount of interest and loan charges you would pay over the entire life of the mortgage loan.,UejikRfTEzYf2gx5QU5bfj
381,What should I do if I don’t understand one of my mortgage closing documents?,"If you don't understand a closing document, ask your lender about it right away.",fHZus2orhDNT6sPf2bwYK9
382,I was asked to sign an “ACH authorization” to allow electronic access to my account in order to repay a payday loan. What is that?,"An Automated Clearing House (ACH) authorization is a payment authorization that gives the lender permission to electronically take money from your bank, credit union, or prepaid card account when your payment is due. You can revoke this authorization.",QLPq3ij2fZhPnAGoiEAwX5
383,What is the difference between a payday loan and a deposit advance?,"Payday loans and deposit advances are both short-term, high-cost loans. Some of the key differences are who makes the loans, how the loan is requested, and how they are repaid.",5iAzbu4B9GxEe8FVrn744X
384,What should I consider if I'm thinking about getting a payday loan online?,Can you pay it back on time? Do you have other choices besides borrowing? How much will it cost? How safe is my personal information online?,AUivsMGUo6vZotF7SKsugK
385,How can I get an electronic periodic mortgage statement?,"If you want to receive your mortgage statement electronically, tell your mortgage servicer.",AfBAxBBpUo9U47SFrvFSMt
386,My credit card statement now has a credit score. What does this mean?,"Recently, several credit card issuers introduced programs that provide customers with free credit scores.",FVjGLRHn4ZHG5eKheeSe4T
387,What do I need to know if I’m thinking about consolidating my credit card debt?,"When you consolidate your credit card debt, you are
taking out a new loan. You have to repay
the new loan just like any other loan. If you get a consolidation loan and keep making more purchases with
credit, you probably won’t succeed in paying down your debt. If you’re having
trouble with credit, consider contacting a credit counselor first.",fK5p7Gsy8CSu2kLYMdjn2j
388,I’ve seen a lot of advertisements for companies that consolidate credit card debt. Are these legitimate?,"Some credit card debt consolidation companies are legitimate, but using such services can be risky. If you are thinking about debt consolidation, you might want to first consult a non-profit credit counselor.",CzdJ2cT2V6ssdshTYTi6qD
389,How do I dispute an error or request information about my mortgage?,"If you think your mortgage servicer has made an error or you need information about your mortgage loan, you can call or write a letter to your servicer. You may get more protections if you write a letter.",WA85Tx3kAWSv356ZynP9QD
390,How long after foreclosure starts will I have to leave my home?,It depends on the state where you live. This could last many months from the date you get the first foreclosure notice to the date the actual foreclosure sale is held.,atwiozXrdy4ydnYFBCVBPr
391,Should I get a payday loan if I need money now?,"Before choosing to take out a payday loan, think about the costs you will pay, whether you want to borrow, and how you will pay back the loan.",o2UXtZXQitcBzonbgFnTfr
392,What are credit card “add-on products?”,"Credit card “add-on products,” are additional, optional services.You don’t have to buy these or other extra products or services from the credit card company to activate your credit card.",iBRrXYi6ZUVqfyZLuA4SLk
393,Can a debt collection agency try to have me arrested over a debt collection?,Collections agencies usually don't have the legal authority to issue arrest warrants or have you put in jail.,j4EiYPp2pDqz5Z8UyjdPBR
394,Can a debt collector garnish my bank account or my wages?,"If a debt collector has a court judgment, then it may be able to garnish your bank account or wages. Certain debts owed to the government may also result in garnishment, even without a judgment. However, if certain federal benefits are directly deposited into your bank account, there are automatic protections under federal law for some of the funds in your account. There may be",3Tm3a2eJKixv6YWP4fpJbn
395,Can a debt collector garnish my federal benefits?,"No, in most cases debt collectors and creditors cannot garnish federal benefits.",TnBHP7zA7GtEjBHVpjPmky
396,What is a judgment?,"A judgment is a court order that is the decision in a lawsuit. If a judgment is entered against you, a debt collector will have stronger tools, like garnishment, to collect the debt.",bXP9JrAkQTbtVrAzN2peeB
397,What's the difference between a credit counselor and a debt settlement or debt relief company?,Credit counseling organizations are usually non-profit organizations that advise you on managing your money and debts and usually offer free educational materials and workshops. Debt settlement companies offer to arrange settlements of your debts with creditors or debt collectors for a fee.,dJDH9LzfJAEvDZNmypii4E
398,What is credit counseling?,"Credit counseling organizations can advise you on your money and debts, help you with a budget, and offer money management workshops.",dsL84Yq3qYt4mGHJySUpxs
399,"A few days after my relative’s obituary appeared in the papers, I got a call from someone who said they were a debt collector and that my relative had owed money. They are telling me I have to pay and asking me for my bank account information so they can withdraw the funds. How do I know if this is a scam? What can I do?",Do not ever give your bank account information to someone who calls you on the phone. This could be a scam. You are not obligated to give the caller this information.,H3kmnZ74tXaLNx7J3mpnY4
400,I was an authorized user on my deceased relative’s credit card account. Am I liable to repay the debt?,"No, being an authorized user generally does not obligate you to pay the debt.",cK9S6UnNVN2q3pitY8a32j
401,I'm a servicemember and I'm being contacted by a debt collector about a debt. What are my rights and where can I get help?,"Depending on your situation, there are different ways to respond  to debt collectors. We have sample letters you can use if you're experiencing common problems.",7eJ2EENzfRu9N6L3G8kQHr
402,"I'm in the military, can a debt collector have my security clearance revoked if I fall behind on paying my debt?","No, a debt collector cannot revoke your security clearance. However, failing to pay debts on time can result in negative information on your credit reports and may cause your security clearance to be pulled when it's up for review.",nR6hT5dm8P3djfY95hK5Gt
403,I'm a servicemember and I'm being sued. What can I do if I can't make it to court to defend myself or a default judgment is entered because I didn't appear in court?,"If you are sued while a servicemember on active duty, you have certain legal protections under the federal Servicemembers Civil Relief Act (SCRA).",ed2Xtgr7YrcELS7WsjnXiw
404,What kind of assistance can I get after a natural disaster?,Relief organizations like the Red Cross can help you with your immediate needs in a disaster.,k3uSPHceEmQsQRWA7eDCY7
405,What are the costs and fees for a payday loan?,Payday loans generally charge a percentage or dollar amount per $100 borrowed.,6B8MyLNUgYQ6wyjuSgwd68
406,How can I tell if a payday lender is licensed to do business in my state?,"If you want to know whether a payday lender is licensed to do business in your state, verify the information with your state regulator or attorney general .",FSKJoCyCHoFzYeYjPHdbHf
407,My debt is several years old. Can debt collectors still collect?,"In most states, if the debt is yours, the amount is correct, and the debt collector is entitled to collect, the collector can continue to ask you to pay the debt. If you are sued, you may have a defense to the lawsuit due to the age of the debt.",a3mGCfE44shXSKRy8AeSAq
408,I saw an ad for a no-payment reverse mortgage from the Department of Veterans Affairs (VA). Is this legitimate?,"No. The VA does not offer no-payment reverse
mortgages.",BN5UubUJhx5B4HVuiWuqWA
409,Are there any laws that protect me if I send money to someone in another country?,"Yes, there are laws to protect you. Many businesses that send money to other countries for consumers must follow federal consumer protection law, as well as some states’ laws.",3dw9ENum2aE28b2aYESFRG
410,I just sent some money to another country and received two pieces of paper that included a lot of information I've never seen before. What are these and what do they mean?,"In October 2013, federal law began requiring many money transfer companies, banks, credit unions, and other financial services companies that make “remittance transfers” to provide you more information before you make an international money transfer.",SFdzAxjPTqdYJtHxPKyvxe
411,"I just sent money to a foreign country. The receipt showed ""other fees"" that would be deducted from the amount transferred. Should I pay more to cover those fees?","In most cases, the company that is sending your money will only ask you to pay the fees and taxes it collects.",iR9D6RxZ5HRhojLh9yGGWm
412,I heard that there are new rules about international money transfers. Who is protected by them?,"Generally, the rules on international money transfers protect consumers in the United States who use a remittance transfer provider to transfer $15 or more to a person or company in another country.",XMYxUcrU7qSAT9VepwQgLC
413,I want to use my bank or credit union to transfer money to someone in another country. Does the new federal law about international money transfers apply?,"When transferring money to another country, new federal laws may apply depending on whether or not your bank or credit union qualifies as a remittance transfer provider and whether your transfer qualifies as a remittance transfer under federal law.",Nj9FCS4ENQBj6Bn2JchK57
414,Can I cancel a money transfer?,"You may be able to cancel a money transfer but it depends on the circumstances. If you would like to cancel a transfer, review your contract and receipt, and contact the company immediately.",YkDQtSL47q7uc3RubRV3Qu
415,I sent money to someone and she couldn't get the money because her information didn't match what I provided. What can I do?,"If you believe you gave wrong information, contact the provider and ask if you can correct it.",2V6orZTisYtEgxnugqCDBU
416,I sent money to the wrong account number. What can I do?,"If you sent money to the wrong account number, contact the company that sent the money transfer immediately.",UYZCYpTaJSWiwyFTcnhhwa
417,I’ve heard that a lot of con artists use money wire transfers to steal people’s money. Is this true? How can I protect myself?,"Yes, con artists use money wire transfers to steal people’s money, for example the ""grandparent scam."" But you can protect yourself by familiarizing yourself with common scams and by knowing your rights.",irETAAXiexqnpLW6GVvwbU
418,"I sent money to a friend in a foreign country, but the amount received was less than what I sent. What can I do?","When you send money to another country, sometimes fees or taxes are charged or deducted after the transfer is sent. Federal law generally gives you the right to have errors investigated.",A4bXuwfv5hr5tpTPFV9KEr
419,I sent money to a foreign country and there were unexpected fees taken out. What should I do?,"When you send money to another country, sometimes fees or taxes are charged or deducted after the transfer is sent. Federal law generally gives you the right to disclosures on fees before you pay and  have errors investigated.",7CsmTEHgXYMYbLr4TtEuqh
420,I sent money to another country and it didn't arrive. What should I do?,"If you believe a mistake was made, contact the company that sent the money right away.",U66ibBt387MybwQAGcYwiv
421,I sent money to another country and it was not available by the date given on the receipt. What can I do?,"If you believe the company that sent the money made a mistake, contact it right away.",jNtEutzM6VJWafBfZUBqcF
422,"I want to submit a complaint about an international money transfer, what should I do?","If you have a complaint about an international money transfer, contact the company that sent the money right away. The sooner you start the complaint process, the sooner your issue could be resolved",HG7SidTGwyFtfp4R9RHJ6w
423,How long do I have to submit a complaint about an international money transfer?,"If you have a complaint about an international money transfer, you have 180 days from the date the money was supposed to be available to submit your complaint to the provider. This date is printed on your money transfer receipt.",fFGvqKdqRu4krLjbFLU3Dm
424,What happens after I complain to a remittance transfer provider about a problem with an international money transfer?,"Under federal law, a remittance transfer provider has 90 days to investigate an error, and is required to notify you of the investigation’s results.",7KJUTntw5tzMCforftJMy7
425,"When I send money out of the country, can I get fee and exchange rate information in my language?","Maybe. It depends on what languages the company uses to advertise, sell, or promote its services where you made the transfer.",nwdAkLq3DwAK2NLGDdXhtu
426,I received a receipt that suggests that I will be charged fees and taxes other than those on the receipt. What does this mean?,"In some cases, when you send money abroad, foreign taxes may be charged on the transfer and the recipient’s bank may deduct additional fees from the amount sent.",ZYN6bEbo3ifg3ygLyujU4S
427,I sent money abroad and my receipt includes three phone numbers to call in case of a problem. Which one should I call?,"A remittance transfer receipt must list the transfer provider’s phone number, as well as a phone number for the CFPB, and sometimes a phone number for a state regulator.",i96tQEcXGhafcZet8JTHxc
428,I understand that companies must correct certain errors in international money transfers. What types of errors are covered?,"There are certain errors that companies must correct in international money transfers. In addition to other errors, a failure to deliver the proper amount of money or failure to deliver funds to the right person generally must be corrected.",SPYE2TBCbYggJgZNN4wGMa
429,I was sending money to another country and the receipt I received said some of the fees were estimates. What does that mean?,Federal law lets remittance transfer providers estimate some of the figures on the forms they provide.,FHgv3oXv2EZps7X5kRqbWJ
430,What is a fiduciary?,"A fiduciary is someone who manages money or property for
someone else. When you are named a fiduciary, you are required by law to manage
the person’s money and property for their benefit, not yours.",BdW7xSuXd4HBQbrcQMycWU
431,Can a power of attorney (POA) be changed or revoked?,Yes.,jf8Yyi744rqNP38woqm6N6
432,What is a guardian of property?,A guardian of property is someone the court names to manage money and property for someone else whom the court has found cannot manage their money and property alone.,ipFQ7sXWRAAQRcvwopEmhL
433,What is a revocable living trust?,A revocable living trust is a legal document that gives you the authority to make decisions about someone else’s money or property being held in a trust.,Hn6rhnygjzJWSYEkdiic8L
434,What is a Social Security representative payee?,"A representative payee is appointed by the Social Security
Administration for another person who needs help managing their Social
Security or Supplemental Security Income benefit payments.",YhDDt3zvdzKwUnhcZKQEzh
435,What is a VA fiduciary?,A fiduciary is someone who manages money or property for someone else. The Department of Veterans Affairs (VA) appoints VA fiduciaries to manage veterans’ benefits for people who can’t manage the funds themselves.,bBnRXk927wxstqcYBCzotD
436,What are my rights under the Military Lending Act?,The Military Lending Act (MLA) says that you can’t be charged an interest rate higher than 36% on most types of consumer loans and provides other significant rights.,AEtogHsMaWU8ebsAvdkk9R
437,What types of loans are covered under the Military Lending Act?,"Payday loans, overdraft lines of credit, and most installment loans are covered by the Military Lending Act.",WBB85mEgZ8mz7nHhndLv9T
438,What is a remittance transfer provider?,"Under federal law, a remittance transfer provider is a business that transfers money electronically for consumers to people and businesses in foreign countries.",f3X9Rt2tQQvfLt53vtrFfU
439,What should I do if I can’t pay my credit card bills?,"If you can't pay your credit card bill, it’s important
that you act right away. Contact your credit card company immediately because
many creditors may be willing to work with you to change your payment if you’re
facing a financial emergency.",9dcJTggNC9prCDTm3PoK6B
440,How do I repay a payday loan?,"In order to obtain a payday loan, you typically must either provide a personal check to the lender or an ACH (Automated Clearing House) authorization to electronically withdraw money from your bank, credit union, or prepaid card account. Carefully read your loan documents so you know exactly how repayment works.",PoAKrGjQgtu83nDywxywF5
441,What should I do when a debt collector contacts me?,"There are different ways to respond appropriately to debt collectors. Depending on your situation, we have sample letters you can use if you're experiencing common problems.",iMYAx54wupdy6bTqqBtSMJ
442,Why did my payday lender charge me a late fee or a non-sufficient funds (NSF) fee?,"If you do not have enough money in your account when the lender attempts to repay itself, there could be additional fees.",XxrSgSfdHoyMvJrijR6Ho9
443,Can a payday lender garnish my wages?,A payday lender can only garnish your wages if it has a court order resulting from a lawsuit against you.,TFTq8kQPmHFdopCxFvcThv
444,I heard that taking out a payday loan can help rebuild my credit or improve my credit score. Is this true?,"Probably not. Payday loans generally are not reported to the three major national credit reporting companies, so they are unlikely to impact your credit scores.",XS5aF5AVMCbsBQxCGHkD9P
445,What happens after I complete an application to determine my options to avoid foreclosure?,"It depends on your situation, but there are steps your servicer must usually take to evaluate your application.",M3PS9FJVvdQwsEMc3SmVwr
446,My payday lender claims to be located in another country and therefore does not have to comply with U.S. federal laws that protect consumers. Is that true?,"Generally, if you take out a payday loan online as a resident of the United States, the lender with whom you’re doing business must follow U.S. federal laws.",ef8WQbZtF2cu3NbzsTsubk
447,My payday lender said my loan would cost 15 percent but my loan documents say the annual percentage rate (APR) is almost 400 percent. What is an APR on a payday loan and how should I use it?,"The APR, or annual percentage rate, is the standard way to compare how much loans cost. It lets you compare the cost of loan products on an “apples-to-apples” basis. Your lender must disclose the APR before you agree to the loan.",Y9KRSrdecZipidKDa9KLcS
448,Could I be arrested if I don’t pay back my payday loan?,"No, you cannot be arrested for defaulting on a payday loan. However, if you are sued or a court judgment has been entered against you and you ignore a court order to appear, a judge may issue a warrant for your arrest.",XLtnS8RcFBv8bntCisyNYv
449,I received notice of an upcoming rate change on my adjustable-rate mortgage (ARM). Why did I receive this and what should I do now?,"Generally, if you have an adjustable-rate mortgage (ARM), your mortgage servicer is required to send you an estimate of your new payment.",BUqcLxxmzY224JrXfNdDkq
450,I wrote a check. How can I tell if it was processed as an electronic payment or as a check payment?,"Your monthly statement will often indicate if a check was processed as an electronic transfer, such as an ACH payment.",DHEqFU9UPtNtaqZtpKwftZ
451,"I applied for a loan modification or other options to avoid foreclosure, but was denied help. My lender said I didn’t meet the qualifications for help. Can I appeal?",It depends. You can only appeal when you’re denied for a loan modification program.,YzXT38FQ2fWpHxS9FLnzZh
452,How can I find out what’s in my medical payment history?,"You should contact the consumer reporting agencies that specialize in medical records or payments. These agencies may supply reports on your prescription drug purchase histories, medical conditions, data from your insurance applications, and data from other sources. Life insurance companies, for example, commonly use these reports to evaluate policy applications from potential customers.",WxJkKNP33ovVydhNWXRfP4
