,title,text,uuid
181,When are late fees charged on an auto loan?,"Whether a late fee is assessed and the amount of the late fee varies by lender, your contract, and according to state law.",erJsUDwU5XBf5WQMF9XNum
182,How do I pay back my Personal Line of Credit?,"Like a credit card, you will pay a monthly bill that shows your advances, payments, interest, and fees.",oBRXaPhHPkrFMphhsEqa5C
183,What is a Personal Line of Credit?,A Personal Line of Credit is a loan that you access from time to time. You write special checks or request a transfer to your checking account by phone or online.,JJi4iyckbHCyT6W4kMd5cH
184,I am a member of the military or spouse/family member of a servicemember and I think I have a loan that exceeds what I can be charged by law. What should I do?,"If you think you have been overcharged for a loan, you should seek legal assistance.",8zG2Dsds2XcueYy9XBXoUC
185,"I am a servicemember planning to buy a vehicle. If I get stationed overseas, will I be able to bring my new vehicle with me?",Many lenders will not let you move your vehicle overseas.  Make sure before you sign the loan contract that your lender will allow the vehicle you intend to buy to be taken out of the country.,iL9AV4FopPVxCa7LJDKKbC
186,Can I prepay my loan at any time without penalty?,Whether you can pay off your auto loan early without a penalty depends on your contract and on your state’s law.,AHmdZjxaNZ47iG85U9L5BL
187,What is the difference between paying interest and paying off my principal in an auto loan?,Principal is the money that you originally agreed to pay back. Interest is the cost of borrowing the principal.,fXprdZe3ZwdmiSdUdVPvRg
188,What should I do if I have problems making my auto loan payments?,"If you are having problems making payments, contact your lender or loan servicer and ask what options are available to you.",cUQV8w9vCk3vWXiVzLDkQc
189,"I am in the military and have an auto lease. If I am ordered to move overseas or deploy, can I cancel or terminate my auto lease without paying early termination charges or a penalty?","Yes, under certain
circumstances, the Servicemembers Civil Relief Act (SCRA) allows active duty
service members to terminate an auto lease without having to pay early
termination charges or a penalty.",JUM3qQ6ygaE5cL9sbdG77f
190,What if the lender offers to just take the vehicle back and forgive the loan? Will it affect my credit report?,"You must get the lender to state in writing that returning the vehicle fully satisfies your loan; otherwise, you may still be liable on the loan and for any deficiency.",ePuFKmoMMdg4TFuh2tdXmt
191,What happens to my credit report if I am late making payments on my auto loan or my car is repossessed?,If you are late making your auto loan payments this will likely show up on your credit report and may affect your ability to obtain other credit.,BLgTGfBWEBQzck3cFU7DpQ
192,I am getting collection calls. What can I do?,You should first determine whether you really are late on your payments.,SFfpbHqerFH4gHiCVsi9yd
193,"What is a “no credit check"" or “buy here, pay here” auto loan?","A “no credit check” or “buy here, pay here”auto loan is offered by dealerships that typically finance auto loans “in-house” to borrowers with no credit or poor credit.",h6RhihYnKDVCMnWc2TbAKS
194,What happens if I left some of my personal possessions in my vehicle when it was repossessed?,"Your rights vary depending on your state, but most states require repossessing companies to make any of your possessions left in the vehicle available to you.",EfL53cJ564uWGLNpaRkiXt
195,"My car has been repossessed, and I was told it will be sold. What can I do?",Your rights after repossession vary depending on your state law.,ktq5ZmiKPwjfjqe2pkfHTW
196,"I am a servicemember who just applied for an auto loan. When I reviewed the paperwork, I noticed that it listed me at a higher rank than I really am. Is this a problem?","Even if a dealer or lender prepared the application for you, you are still responsible for the information on it.",i2nemDTQAFeNUfKQ6B4SyW
197,What is force-placed insurance?,"In order to get a loan to buy a vehicle, you must have insurance to cover the vehicle itself. If you fail to obtain insurance or you let your insurance lapse, the contract usually gives the lender the right  to get insurance to cover the vehicle. This insurance is called “force-placed insurance.”",oBZoPpSnfFBkKyD8RvwhwP
198,I received a check that someone forgot to sign. Can I still cash it?,"Generally, the bank or credit union will likely either not accept the check or return it to you.",WVmZTSz3fdoAzg7trbuZBH
199,Can a bank or credit union cash a post-dated check before the date on the check?,Yes. Banks and credit unions generally don’t have to wait until the date you put on a check to cash it.,LRX7GAMvDMpGJvHFGqQjav
200,I received a check where the words and the numbers for the amount are different. Is this check valid and for how much?,"Yes, this check is valid.",Gu4YpaNeNPHMpMVDHhzUSy
201,How does a down payment affect my auto loan?,"A down payment is an initial, upfront payment you make towards the total cost of the vehicle.",B7TkRnaVynZoBwvNwGnxKH
202,How can I find out what my trade-in vehicle is worth?,"You can look up the approximate value using online commercial websites such as the Consumer Reports, Edmunds, Kelley Blue Book, NADA Guides and online classifieds. These resources may be available at your local library. Finding examples of similar vehicles that have sold recently in your area will help you know a fair price.",cwJejANSp5Ju5P68FmWQoH
203,Does my bank/credit union have to send me a monthly statement for my checking account?,"Not necessarily. Most banks or credit unions will send a statement every month. However, banks and credit unions only have to send a monthly statement if you made at least one electronic fund transfer that month.",Prcgr9eg3nJiNFn4UYHDf4
204,"I opened a ""free"" checking account. I received a notice from the bank/credit union stating that it had decided to start charging monthly fees. Can the bank/credit union do this?",Yes. A bank or credit union can start charging you fees on your account as long as the bank or credit union notifies you in writing at least 30 days before it starts charging fees and explains the change to your account.,kr2cag9ExiwKnEhcaMjYkG
205,How do I qualify for an advertised 0% auto financing?,"In general, only consumers with the highest credit scores qualify for 0% financing offers. Before you shop, check your credit report at one of the three nationwide consumer reporting agencies – TransUnion, Equifax, and Experian – and check for errors. Incorrect, negative information in your file could prevent you from qualifying for some offers. If there are errors, you can ask that the credit errors be corrected.",nrHoQgAiZaMnHFLorkmeZ4
206,What are manufacturer incentives?,"Manufacturer incentives are special deals, like 0% financing or cash rebates that you may have seen advertised for new vehicles. Often, they are offered only for certain models.",5cKazbDVxPjffVLhAg3F83
207,Will an auto loan help me rebuild my credit?,"If you make timely payments, an auto loan will help you build your credit if the lender reports your payments to one or more of the three major credit bureaus (Experian, Equifax, and TransUnion).",ciUtTUwceqq57h23389mgT
208,Should I have car insurance lined up before I purchase a vehicle?,"If you don’t already have auto insurance, you should shop for insurance before you purchase a vehicle. If you already have insurance, your current insurer can tell you how to add any new vehicle to your policy and how much it will cost.",CFkfkm2fpDNFV7gZLxJPxE
209,Do I have to get my loan from the dealer?,"No, you do not have to get a loan from the dealer.",kTm8fvmkmjyAiBvLBR8ueU
210,Can I negotiate the interest rate on an auto loan with the dealer?,"Yes, just like the price of the vehicle, the interest rate is negotiable.",Ce6YLFxQBJbjEYsW94FmHV
211,What is credit insurance for an auto loan?,"Credit insurance is optional insurance that make your auto payments to your lender in certain situations, such as if you die or become disabled. When you are applying for your auto loan, you may be asked if you want to buy credit insurance.",o4WqzW2AGnCe3eL6k278nx
212,What are debt cancellation or debt suspension products offered with an auto loan?,"Some auto dealers as well as banks and credit unions offer “debt cancellation” and “debt suspension” products or insurance under various names. These products are similar to credit insurance in terms of their function, but fees and other features may be different.",F6CsdJw8nJ52kCaTM9SFCg
213,"I opened a ""free"" checking account but there are fees charged on my account. Can my bank/credit union do that?","If an account is described as “free” or “no cost,” it cannot have any monthly service fees, fees for exceeding a specified number of transactions, or any fees to deposit, withdraw, or transfer money.",RzZQZNZoTvCB95pAWVr9CY
214,Am I required to purchase an extended warranty or Guaranteed Auto Protection (GAP) insurance from a lender or dealer to get an auto loan?,It is highly unusual for a lender or dealer to require an extended warranty or GAP insurance.,E2fW5hCLT2WaYXGSNbx7XX
215,The bank/credit union closed my checking account even though I did not want them to. Can the bank/credit union do that?,"Yes, a bank or credit union can close your account without your permission.",RjvUhYTWAobtUKkRiCRsN7
216,Do I have to negotiate my vehicle purchase at the same time as I negotiate how much I get for my trade-in or the terms of a loan from the dealer?,You are not required to get a loan from a dealer or trade in a vehicle in order to purchase a vehicle from a dealer. You should negotiate each part of the deal separately and comparison shop to get the best overall deal.,degVsrnuM3cnzqcZVNqQC5
217,Can I close my account whenever I want?,"Most of the time, yes, but your bank or credit union may require you to settle your balance before allowing you to close an account that is overdrawn.",e9WByZz52cQbCpe3DrPKsd
218,My bank/credit union no longer provides copies of my cancelled checks with my statement. Can the bank/credit union do that?,Yes. Banks and credit unions are generally not required by law to return cancelled checks or check images.,gfSgmkcrGkbHjS7D9jHqLh
219,What is a credit union share draft account? Is it a checking account?,Credit unions refer to checking accounts as share draft accounts.,7z2jYhbY4ZiG8DKHh2mSn3
220,Why might I need a co-signer in order to get vehicle financing?,"A co-signer is a person –  such as a parent, close family member or friend – who pledges to pay back the loan if you do not. This can be a benefit both to you and your lender.",XtgGJoXSC3ZPvL4kydNmB5
221,I was asked to co-sign financing for a car. What am I being asked to do and what does this mean for me?,"If you co-sign a loan, you are legally obligated to repay the loan in full. Co-signing a loan does not mean serving as a character reference for someone else. When you co-sign, you promise to pay the loan yourself.",gaFgH8vuo9sffCbwmNuv3m
222,What should I know about the differences between leasing and buying a vehicle?,A lease is an agreement to use a vehicle for an agreed number of months and miles. You may lease a new or used vehicle.,FPSXXEPZjNMXxXxPsgiSbZ
223,Can a bank or credit union refuse to open a checking account for me?,Yes. There are a number of reasons why a bank or credit union may refuse to open a checking account.,GQeWJ94mk9DxF8Voq67wyn
224,"What does it mean for a check to be indorsed ""for deposit only""?","If you write “for deposit only” on the back of a check made out to you and then sign your name, the check can only be deposited in your account.",V3rUPuZXDpyKuStjw7bhbE
225,What is a retail installment sales contract or agreement? Is this a loan?,"A retail installment sales contract agreement is slightly different from a loan. Both are ways for you to obtain a vehicle by agreeing to make payments over time. In both, you are generally bound to the agreement after signing.",FfdgV6YcywtwdDWLrzmpQn
226,What is included in the monthly auto loan payment,The monthly payment includes all charges agreed to in the contract. This will include the principal and the interest on your loan. Your monthly payment may also include credit insurance charges or other optional add-ons that you agreed to finance as part of your auto loan. Late fees may also be added if allowed in your contract and you have paid late.,CPBnWrScw9jYKSfjeF9cTY
227,Is the price for add-ons such as an extended warranty or Guaranteed Auto Protection (GAP) insurance negotiable?,"Yes, the price for add-ons is negotiable, just like interest rates and the length of the loan.",hRUHBSrL8QUsodmwv4nFoU
228,My auto loan paperwork said the extended warranty was optional but I was told that I was required to purchase an extended warranty to get the promotional interest rate. Do I have to purchase it?,"If the paperwork says the warranty is optional, the dealer can’t require you to purchase it.",ew6zpq2QQxfmTpZdgNpH7T
229,What is the difference between a manufacturer’s warranty and an extended vehicle warranty or service contract?,Warranties provided by the manufacturer as part of the vehicle cost typically cover only certain problems with the vehicle. Extended warranties or service contracts sold for an additional charge typically cover problems with mechanical and electrical parts not covered by the manufacturers' warranty.,CJXBaPH5EDfdhNWRC2jPis
230,"What does it mean to ""default"" on my private student loans?","Private student loans often go into default as soon as you miss three monthly payments (120 days). You can also default on a private student loan if you declare bankruptcy, default on another loan, or die.",aFqkSsfRQvrxZdagSe6mwB
231,What is a Stafford loan?,Stafford loans are a type of federal student loan that are either subsidized – the government pays the interest while you're in school – or unsubsidized – you pay all the interest.,9SWE63gotVxufpq4LE7Kog
232,How might the U. S. Department of Education collect payments from me?,"While other lenders typically have to take you to court to collect, the Department of Education has many more ways to collect payment of your student loans.",SGaDVpi5rqRGeLFPjvdk2M
233,Can I ever waive my right to rescind on my mortgage loan?,Yes. You can waive your right of rescission (your right to cancel your transaction within three business days for your refinance or home equity line of credit).,euzwSqCeV5tzBWg7kPNR2U
234,"I want to sue the card issuer that issued my credit card, but they tell me I have to use arbitration. Is that right?","Some cardholder agreements contain arbitration provisions. You should be able to find a copy of the agreement on your card issuer's website, and you can request a copy from your card issuer if it is not there.",ScfudJJmePoCYJafWWxHGA
235,"I just received a new card from the card issuer with a new account number and a letter saying my account had been ""compromised."" What does that mean? What should I do?",This typically means that your account number may have been improperly obtained by someone who is not authorized to use it.,HrwsAr78DWYgLK6p2UiBKB
236,I sent my payment to the card issuer but I: forgot to include the payment stub; sent the payment to the wrong address; sent cash rather than a check; sent a check in foreign currency. What happens?,"Under the law, a card issuer can establish ""reasonable requirements"" with respect to how payments are made, such as requiring that you include your account number or payment stub and pay by check or money order in U.S. dollars to an address specified by the card issuer.",G56qL7QUkEmmjwXTcsvRrU
237,What should I do if my payment does not show on my credit card statement?,"You should let your credit card company know if your payment does not show on your statement. You can call the card company to try and resolve the issue quickly. However, in order to protect your rights you must send a written billing error notice to the card issuer. You should send the written notice within 60 days of receiving the statement that should have reflected the payment.",PWTmHs9xZa2XFxjw2UXv2r
238,Can my credit card issuer reduce my credit limit?,"Credit card companies generally can increase or decrease credit limits without giving you notice, including reducing your credit limit so that you no longer have any available credit. If you no longer have any available credit, you cannot make any charges until you pay off some of your existing balance.",3XKN5auxqM3aTDHLw9YgN3
239,Can my credit card company change the terms of my account?,"The credit card company has the right to change the terms of your credit card agreement. For significant changes, the card issuer generally must give you notice 45 days in advance.",hW2JiaATE4wxxEdFbiAjpt
240,I noticed that the interest rate on my card went up last month without any notice. Can they do that?,Your card issuer generally must give you 45 days advance notice before it raises your interest rate on new purchases; there are additional rules that restrict when the card issuer can raise your rate on your existing balance.,3TngVadKsiYhcSH2cg2AtG
241,I did not receive a bill last month. The current bill shows a past due amount and charges interest for the charges from the prior month. What should I do?,"You should let your card issuer know. While you can call the card issuer, in order to protect your rights you must send a written notice to the card issuer.",UUBvqie2jUGrFd9HWZpbNk
242,Will I damage my credit score if I do not pay a portion of my bill that I am disputing?,"While a card issuer is investigating a dispute, the issuer cannot report your account as delinquent if you have paid the undisputed portion or the minimum amount due.",74Gvh37MLmFufoFuhe5cbc
243,How long can the card issuer take to resolve my billing error or dispute?,"The card issuer must send you a letter stating that it has received your billing dispute within 30 days of receiving it. The card issuer must complete its investigation within two complete billing cycles of receiving the dispute, which generally means two months, and cannot take more than 90 days.",TsYJA6zzLnzCyjGyWYxFrv
244,Can they charge me interest on a charge I told them I did not make?,"If you have given the card issuer written notice of the billing dispute, you do not have to pay the amount in dispute while the card issuer is investigating, and the card issuer cannot charge interest on that amount.",dem8FtPCh9KxASu2UMupp2
245,What should I do if I disputed a charge on my credit card but it is still on my statement?,"If you sent your credit card company a written billing error notice within 60 days of the company sending you the statement showing the error, the card company should acknowledge the billing error notice within 30 days of receiving it. However, the card company is allowed to take up to two billing cycles to resolve any errors it finds.",ftkucHfTa9DsS7aJ8Z6Fbq
246,"Can my credit card company charge a fee based on how I paid my bill, such as for making a payment over the phone?","It depends. Generally, the credit card company cannot charge you a fee for making a payment.",AugBvwpCZyceCM5KRh6LGd
247,How do I send my credit card company a billing error notice?,"If you believe an error has been made on your credit card bill, you should send your credit card company a written letter within 60 days of the charge appearing on your billing statement. The letter should include information that identifies yourself and what you are disputing. After sending the letter, you have certain rights that should be honored until a decision is made by your credit card issuer.",9iHsBQ7MmABNNU4Kbjs4wY
248,I bought something with my credit card when I was abroad and when the bill came there was a 2 percent fee. What’s that?,Many credit card companies charge a fee for purchases made in a foreign country.  Sometimes this is called a foreign transaction fee. Different card companies have different rules about these fees.,CLcqmcRBBQ9xgdxxhQd4dX
249,How long do I have to rescind? When does the right of rescission start?,"If you are buying a home with a mortgage, you do not have a right to cancel the loan once the closing documents are signed. If you are refinancing a mortgage, you have until midnight of the third business day after the transaction to rescind (cancel) the mortgage contract.",gtNKwdu3Qmep7fRduuMhQ3
250,My lender or broker never provided me with the notice of a right to rescind for a mortgage loan. What can I do?,"If you never received the Truth-in-Lending disclosure or the Notice of Right to Rescind from the lender and you were entitled to receive one, you may still be able to rescind your mortgage loan.",PVudJNoWdRpDQnGdMWqdfE
251,"What does it mean to ""default"" on my federal student loans?","Default is the failure to repay a loan according to the terms agreed to in the promissory note. For most federal student loans, you will default if you have not made a payment in more than 270 days.",bckFZHadxh9Nk46rny9CwJ
252,How do I manage my monthly mortgage payment?,Your monthly mortgage statement has information that you can use to stay on top of your mortgage payment.,iRn3ZyotyosnabrgvGG2yR
253,"My payment was returned to me, and the servicer notified me it is no longer servicing my loan. Then I got another notice in the mail saying I was late on my payment, but no one ever notified me that I needed to send my payment somewhere else. What can I do?","If the servicing rights for your loan are sold, your old and new servicers must notify you of the transfer of the servicing rights to your loan.",Y4CmvS72tJ9kjtuDEoHe5K
254,I paid off my mortgage but it is still listed on my credit report as outstanding. What can I do?,You should file a dispute with the credit bureaus about the error.,7yicRjyDJyt5DTDVot6uqc
255,My mortgage servicer refuses to accept my payment. What can I do?,You can either call or write a letter to your servicer requesting an explanation.,G9yXcsc33o6KpoZiunXpWW
256,What can I do if my mortgage lender or servicer is charging me for force-placed homeowner’s insurance?,Make sure you have your own homeowner’s insurance and send proof to your mortgage servicer.,4GyoHA99LdGgnVMNGiHXRb
257,What should I do if I get a tax bill from the city or county saying that my mortgage servicer did not pay my taxes?,Send a notice of error to your servicer and contact your tax authority and insurance carrier as soon as possible.,XujiQokLaXdSvKTU3wokjA
258,How do I get mortgage information about a home I inherited?,"To receive certain information about the mortgage account, you should contact the mortgage servicer. You may need to show the mortgage servicer proof of your right to the home.",CegNnYBqUbPPXQ8nTFVMsc
259,I mailed my mortgage payment before it was due but my servicer received it after the due date and charged me a late fee. Can my servicer do this?,"Yes, your servicer can charge you a late fee if it receives your payment after the due date, even if you mailed your payment on time.",LiRHZHwx3SAbGtcLy4Uy7m
260,What happens if the company that I send my mortgage payments to changes?,The company that you send your monthly mortgage payments to is your mortgage servicer. Your servicer can change.,JacN5tSYLnwaShdMdXbhhx
261,Why did my monthly mortgage payment go up or change?,Several things can cause your mortgage payment to change. Check your mortgage statement or contact your servicer and ask them to explain.,L54BRv6awmdoZrnrj3vvix
262,I disagree with my mortgage servicer about the amount it says that I owe. What can I do?,"If you disagree with your mortgage servicer about how much you owe, you can either call or send a notice of error letter to your servicer.",Xh8jHDVzny5qxNxrS55VMZ
263,My mortgage servicer has not responded to a notice of error or information request that I sent. What can I do?,"If you have a problem with your mortgage, you can submit a complaint to the CFPB.",4kqSZec997A4urKPSaTkfM
264,Someone offered to write an information request or error dispute to my mortgage servicer for a fee. Can I do this for free?,Yes. You don’t have to pay anyone to write an information request or an error dispute to your servicer. You can do this yourself.,ECcPJZs5FNoJUTnj928htU
265,Can my mortgage servicer report negative information about me to a credit-reporting agency after I have sent an error dispute or information request?,"It depends. If your notice of error is in regards to a payment, your servicer can’t provide negative information about that payment to any consumer reporting agency or credit bureau for the 60 days after it receives your notice of error.",LmWvPb2NDHaEpefBkFf3DN
266,"Can I send a QWR, error dispute, or information request to my mortgage servicer no matter what kind of mortgage I have?","If you have a closed-end mortgage, your mortgage servicer is required to follow certain rules.",AFFvDAKRtods8YquWsSRiu
267,What happens if my mortgage is sold? Is my loan safe?,"If your loan is sold, then your lender must provide you with a loan ownership transfer notice.",94r3ctDLTG4LfpgJHQH3Qu
268,Do I pay interest on new purchases after I get a zero or low rate balance transfer?,"For most credit cards, if you carry a balance month to month, any purchases you make will accrue interest from the date of the transaction. This is true even if another balance you are carrying is not subject to interest because it was a 0% balance transfer.",MKWRAL6DB9uX2UbzUNwVuh
269,I paid off my entire bill when it was due last month and still got charged interest. How can that be?,"If you've been carrying a balance, most card issuers will charge you interest from the time your bill was sent to you until the time your card issuer receives your payment.",F6Hck3zydoqijPiEcvmFfj
